{
  "$schema": "http://json-schema.org/draft/2020-12/schema#",
  "title": "Phi Lexicon Entry",
  "type": "object",
  "properties": {
    "word": {
      "type": "string",
      "description": "The Phi word."
    },
    "gloss": {
      "type": "string",
      "description": "A concise, 1-2 word English gloss or a Leipzig abbreviation for grammatical particles."
    },
    "ipa": {
      "type": "string",
      "description": "The International Phonetic Alphabet transcription, including stress marks and syllable breaks."
    },
    "syllables": {
      "type": "array",
      "items": {
        "type": "string"
      },
      "description": "The word broken down into its constituent CV syllables for rule validation."
    },
    "slot": {
      "type": "integer",
      "enum": [0, 1, 2],
      "description": "The particle's position in the three-slot system. REQUIRED for particles; FORBIDDEN for every other part of speech."
    },
    "pos": {
      "type": "array",
      "items": {
        "type": "string",
        "enum": [
          "noun",
          "verb",
          "adjective",
          "numeral",
          "particle",
          "preposition",
          "pronoun",
          "conjunction",
          "complementizer",
          "interrogative",
          "discourse",
          "classifier",
          "quantifier",
          "vocative",
          "interjection"
        ]
      },
      "minItems": 1,
      "description": "Lexically listed senses only \u2014 the senses that must be learned per word. Every verb's event/result noun is supplied by the event-noun rule (canon.md) and is NOT listed here; a listed noun+verb combination therefore always signals an idiosyncratic pairing (instrument, role, phenomenon, substance, entity) explained in the entry."
    },
    "concept": {
      "type": "string",
      "description": "The full concept name from the unified concepts document or grammar role."
    },
    "description": {
      "type": "string",
      "description": "The detailed description of the concept's meaning and nuance."
    },
    "sound_symbolism": {
      "type": "string",
      "description": "The poetic description of how the word's sounds embody its meaning through phonetic symbolism."
    },
    "grammatical_notes": {
      "type": "string",
      "description": "Cross-linguistic context explaining the word's grammatical flexibility and syntactic patterns."
    },
    "pillars": {
      "type": "object",
      "properties": {
        "solarpunk-values": {
          "type": "string",
          "description": "Rationale for how this concept embodies solarpunk values."
        },
        "secular-buddhist-philosophy": {
          "type": "string",
          "description": "Rationale for how this concept embodies secular Buddhist philosophy."
        },
        "art-nouveau-aesthetics": {
          "type": "string",
          "description": "Rationale for how this concept embodies Art Nouveau aesthetics."
        },
        "peace-linguistics-practices": {
          "type": "string",
          "description": "Rationale for how this concept embodies peace linguistics practices."
        },
        "pre-industrial-wisdom": {
          "type": "string",
          "description": "Rationale for how this concept embodies pre-industrial wisdom."
        }
      },
      "additionalProperties": false,
      "description": "The philosophical pillars this concept primarily embodies, with rationales for each."
    },
    "tags": {
      "type": "object",
      "additionalProperties": {
        "type": "string"
      },
      "description": "Semantic domain tags with brief rationales explaining how this word relates to each domain."
    }
  },
  "required": [
    "word",
    "gloss",
    "ipa",
    "syllables",
    "pos",
    "concept",
    "description",
    "sound_symbolism",
    "grammatical_notes",
    "pillars"
  ],
  "additionalProperties": false,
  "if": {
    "properties": {
      "pos": {
        "contains": {
          "const": "particle"
        }
      }
    }
  },
  "then": {
    "required": [
      "slot"
    ]
  },
  "else": {
    "not": {
      "required": [
        "slot"
      ]
    }
  }
}