{
  "word": "sua",
  "gloss": "INT.P",
  "ipa": "/ˈsu.ä/",
  "syllables": [
    "su",
    "a"
  ],
  "pos": [
    "interrogative"
  ],
  "concept": "Who / Which Person",
  "description": "The interrogative for inquiring about personal identity, seeking to know which individual or individuals are involved. Unlike demanding identification, 'sua' opens a space for self-revelation, transforming the potential violence of 'who goes there?' into the gentleness of 'who are you?'",
  "sound_symbolism": "The word begins with 'su', where the soft sibilant 's' creates a searching sound, like awareness reaching out into social space. The vowel 'u' forms in the back of the mouth, deep and mysterious, acknowledging the profound unknowability of another being. This opens into 'a', the most open vowel, creating acoustic space for the other to fill with their identity. The sound journey from mysterious depth to open receptivity mirrors the ethical movement from encountering an unknown other to welcoming their self-disclosure.",
  "grammatical_notes": "Functions as an interrogative pronoun, able to serve as subject, object, or within prepositional phrases. Unlike English, does not distinguish between subjective 'who' and objective 'whom'—maintaining grammatical equality regardless of syntactic position. Can refer to singular or plural referents without modification. In indirect questions, maintains the same form without the interrogative particle 'wa'. Example: 'sua lothea shelomui' (Who understands love?).",
  "pillars": {
    "solarpunk-values": "In communities of mutual aid and collaboration, knowing who participates becomes less about surveillance and more about connection. 'Sua' serves this collaborative knowing, asking about identity to build relationship rather than establish hierarchy.",
    "secular-buddhist-philosophy": "The word acknowledges the paradox of identity—we must use language to ask 'who' even as we understand the constructed nature of self. 'Sua' permits practical communication about persons while avoiding the violence of fixing identity too rigidly.",
    "peace-linguistics-practices": "By beginning with soft sounds rather than harsh stops, 'sua' makes inquiry gentle rather than aggressive. It embodies the practice of asking about identity in ways that invite rather than interrogate, that honor the sovereignty of others to name themselves."
  }
}
