{
  "word": "thuleni",
  "gloss": "comfort",
  "ipa": "/θu.le.ni/",
  "syllables": ["ru", "le", "ni"],
  "pos": ["verb", "noun"],
  "concept": "Comfort / Ease Distress / Soothe Suffering",
  "description": "To ease another's distress, offering presence, words, or touch that reduces suffering. 'Thuleni' names the active response to another's pain—not fixing the cause but easing the experience, making the unbearable more bearable through companionship and care.",
  "sound_symbolism": "The word soothes like comfort itself. 'Thu' /θu/ begins with dental breath, soft and unhurried. Then 'le' lifts gently with liquid ease, burden lightening. Finally 'ni' settles with nasal calm, distress subsiding.",
  "grammatical_notes": "As verb: 'mi ru thuleni' (I comfort you). As noun: 'wela thuleni' (good comfort). Can specify context: 'mi ru lo lau themo thuleni' (I comfort you in great difficulty). Related to phamo (console) but broader—thuleni applies to any distress.",
  "pillars": {
    "secular-buddhist-philosophy": "Compassion (karuna) responds to suffering with the wish to ease it. 'Thuleni' is compassion in action.",
    "peace-linguistics-practices": "Comforting presence may be more valuable than problem-solving—sometimes being with is the truest help."
  },
  "tags": {
    "emotion": "Responding to others' distress",
    "community": "Caring for those who suffer"
  }
}
