{
  "word": "relu",
  "gloss": "revere",
  "ipa": "/ˈre̞.lu/",
  "syllables": [
    "re",
    "lu"
  ],
  "pos": [
    "verb"
  ],
  "concept": "Revere / Honor Deeply / Venerate",
  "description": "To regard with deep respect and honor; veneration that recognizes worth. 'Relu' names the honoring gaze—seeing and acknowledging what is worthy of respect.",
  "sound_symbolism": "The word honors gently. 'Re' resonates with recognition, worth seen. 'Lu' flows with lifting respect, honor given.",
  "grammatical_notes": "Functions as verb: 'mi relu' (I revere). Takes object of reverence. Related to 'thunoa' (dignified) and 'rolia' (worth).",
  "pillars": {
    "pre-industrial-wisdom": "Reverence for elders—traditional honoring of those who carry wisdom.",
    "secular-buddhist-philosophy": "Reverence without attachment—honoring without grasping or idolizing."
  },
  "tags": {
    "emotion": "Deep respect",
    "ritual": "Honoring practice"
  }
}
