{
  "word": "selu",
  "gloss": "three",
  "ipa": "/se.lu/",
  "syllables": ["se", "lu"],
  "pos": ["numeral"],
  "concept": "Three / Creation / Dynamic Balance",
  "description": "The numeral representing synthesis, the emergence of the new from the meeting of two. More than progression from two, 'selu' acknowledges the creative principle—when thesis meets antithesis, synthesis arises; when two parents meet, new life emerges; when two ideas combine, innovation is born.",
  "sound_symbolism": "The word begins with 's', the flowing sibilant that suggests movement and transformation. This meets 'e', the clear mid vowel of conscious awareness. The flow continues through 'l', the liquid connector, to 'u', the deep back vowel of mystery and depth. The progression from flowing clarity ('se') to deep connection ('lu') mirrors how three emerges—not just adding one more, but creating something qualitatively new from combination.",
  "grammatical_notes": "Functions as the third cardinal numeral, often carrying special significance as the first number beyond binary opposition. Requires the plural particle 'lo' when modifying countable nouns. In Phi philosophy, three often represents completion of a basic cycle—beginning, middle, end; thesis, antithesis, synthesis. May appear in formulaic expressions and traditional sayings.",
  "pillars": {
    "secular-buddhist-philosophy": "Three embodies the Middle Way—not this extreme or that, but the path between. Like the Three Jewels (Buddha, Dharma, Sangha) or the three marks of existence, 'selu' represents completeness through trinity, wisdom through triangulation.",
    "pre-industrial-wisdom": "Traditional knowledge recognizes powerful threes—past, present, future; birth, life, death; maiden, mother, crone. 'Selu' carries this understanding that three creates stable dynamism."
  }
}
