{
  "word": "sai",
  "gloss": "PAIN",
  "ipa": "/sa.i/",
  "syllables": [
    "sa",
    "i"
  ],
  "pos": [
    "interjection"
  ],
  "concept": "Ouch / Ow / Pain Expression",
  "description": "An interjection expressing physical or emotional pain, discomfort, or sudden unpleasant sensation. More than mere reflex, 'sai' acknowledges pain as communication—that expressing hurt serves both personal release and social signaling, inviting care without demanding rescue.",
  "sound_symbolism": "The interjection begins with 's', the sharp sibilant that hisses like the intake of breath when pain strikes. This meets 'a', the open vowel of release and expression. The hiatus lifts into 'i', the high tense vowel that carries the acute quality of pain. The CVV structure allows the word to move from the sharp recognition of hurt ('sa') to its peaked intensity ('i'), mirroring the experience of pain itself.",
  "grammatical_notes": "Functions as a complete utterance in response to painful stimuli, whether physical or emotional. The vowel hiatus allows for prosodic extension when pain lingers. Context determines whether the pain is physical, emotional, or metaphorical. Tone and duration indicate severity while maintaining the basic pain-signaling function.",
  "pillars": {
    "secular-buddhist-philosophy": "The interjection embodies the First Noble Truth—the acknowledgment of suffering as part of existence. Rather than denying or dramatizing pain, 'sai' provides a middle way of honest expression that neither suppresses nor amplifies the experience.",
    "peace-linguistics-practices": "By providing a clear way to express pain without blame or aggression, 'sai' prevents the violence that can arise from unexpressed hurt. It allows pain to be communicated as information rather than accusation, inviting compassion rather than conflict.",
    "pre-industrial-wisdom": "Traditional healing begins with acknowledging pain rather than hiding it. 'Sai' carries this wisdom that expressing hurt is not weakness but the first step toward care, that pain shared in community becomes more bearable."
  }
}