{
  "word": "ka",
  "gloss": "CAUS",
  "ipa": "/ka/",
  "syllables": [
    "ka"
  ],
  "pos": [
    "particle"
  ],
  "slot": 1,
  "concept": "Cause to / Make / Enable Action",
  "description": "A modal particle that indicates the subject causes someone or something else to perform the verb's action. More than simple coercion, 'ka' acknowledges the complex web of causation—from gentle enabling to direct instruction, from creating conditions to removing obstacles.",
  "sound_symbolism": "The particle begins with 'k', a clear velar stop that creates definite acoustic events—the back of tongue briefly blocking then releasing airflow like the decisive moment of causation. This active consonant meets 'a', the open vowel that provides space for effect to follow cause. Together, 'ka' sounds like causation itself: the sharp 'k' initiates while the open 'a' allows consequences to unfold. The sound's clarity reflects the transparency needed when one being influences another's actions.",
  "grammatical_notes": "Occupies Slot 1 as a modal particle, creating causative constructions that add a causer to the sentence structure. With intransitive verbs: the new subject causes the original subject to perform the action. With transitive verbs: the new subject causes the original subject to perform the action on the original object. Thus 'mia child ka sleep' (I make the child sleep) and 'mia you story ka understand' (I make you understand the story). Does not specify the means of causation—context determines whether through force, persuasion, or enablement.",
  "pillars": {
    "secular-buddhist-philosophy": "The particle embodies the teaching of dependent origination in its interpersonal dimension—how beings become conditions for each other's actions. 'Ka' acknowledges that we inevitably influence each other while maintaining awareness of the karma created through causation.",
    "peace-linguistics-practices": "By marking causation explicitly, 'ka' makes influence visible rather than hidden. This transparency enables discussion of power dynamics, consent, and agency—crucial for preventing the violence that comes from unexamined influence.",
    "solarpunk-values": "Building regenerative systems requires understanding causation—how to create conditions where beneficial actions naturally arise. 'Ka' enables thinking about systemic change through enabling rather than forcing."
  }
}